{
  "lead_id": "lead_demo_0001",
  "created_at": "2026-05-06T15:30:00Z",
  "source": "d3x.biz",
  "source_channel": "public_website",
  "name": "Sample Lead",
  "company": "Sample Operations Studio",
  "email": "sample.lead@example.com",
  "phone": "+1 555 010 0000",
  "business_type": "local_business",
  "process_problem": "The team spends several hours every week copying order data between spreadsheets and creating manual status reports.",
  "current_tools": [
    "Google Sheets",
    "Email",
    "Manual reports"
  ],
  "urgency": "medium",
  "budget_range": "1500_5000_usd",
  "consent": {
    "provided": true,
    "text": "I agree to be contacted about this request.",
    "provided_at": "2026-05-06T15:30:00Z"
  },
  "status": "received",
  "assigned_agent": null,
  "lead_score": null,
  "notes": "Fake sample data for schema validation only.",
  "workspace_row_id": "sheet_row_demo_42",
  "imported_at": null,
  "import_status": "not_imported"
}
